spotify_id,song_name,artist_name,genius_id,genius_title,genius_artist,lyrics,genius_url,extraction_status
5nvUqq0fvB0GN6mqzDc9Ey,Love Is A Matter Of Distance,Will Young,1692053.0,Love Is a Matter of Distance,Will Young,"Love is a matter of difference
Between you and me
Love is a matter of distance
That you are too far away
Love is a matter of growing
And knowing true feelings
Love is a matter of showing
That you are so far away
When my heart is open
My mind is openin' to find
I can't let you stay
The love is a matter of difference
You are too far away
Love is a matter of inputs
Outlook, deep inside
Love is to know you're on my side
That you are so far away
When my heart is open
My mind is openin' to find
I can't let you stay
The love is a matter of difference
You are too far away
Yeah
Yeah, yeah, yeah
Ohh, ohh, yeah
Yeah, when my heart is open
My mind is openin' to find
I can't let you stay
The love is a matter of difference
You are too far away
If love is a matter of distance
You are too far away
Yeah",https://genius.com/Will-young-love-is-a-matter-of-distance-lyrics,success
4KepeWvq5KfZUevd0cQ70T,Dance The Night Away,Will Young,1468224.0,Dance The Night Away,Will Young,"People get the wrong impression
I wonder if they change their minds
It's an understated sign
Tell me how you see me again
Now we're swinging to the time
It's a meeting of the minds
It's all oh unbelievable, yay
Look to play it, how we say it
If you're meaning to delay it, hang on
'Cause we're moving all around, yeah
Now it's up when the party's over
And we want to free our minds
Now I'm telling you there's no hurry
Uh huh, 'cause we're choosing to groove
It's so cool to dance the night away
(Aye, whoo!)
I choose to live a good life
Have a good time and enjoy the ride
Turn it up, break it down, move on
High times took a good turn
Spinnin' it around 'cause you got to learn
To rectify, justify this song
Now we're swinging to the time
It's a meeting of the minds
It's all, oh unbelievable
(So, so)
Look to play it how we say it
If you're meaning to delay it, hang on
'Cause we're movin' all around
Now it's up when the party's over
(When the party's over)
And we want to free our minds
(We gotta get all down)
Now I'm telling you there's no hurry
(Huh uh)
'Cause we're choosing to groove
It's so cool to dance the night away
(Aye, way)
Now it's up when the party's over
And we want to free our minds
Now I'm telling you there's no hurry
(Huh uh)
'Cause we're choosing to groove
It's so cool to dance the night way
Now it's up when the party's over
(Whoo!)
And we want to free our minds
Now I'm telling you there's no hurry
'Cause we're choosing to groove
It's so cool to dance the night away
(Aye, aye, aye)
Dance the night
Dance the night
Dance the night away
Dance the night
Dance the night
Dance the night away
Dance the night
Dance the night
Dance the night away
Dance the night
Dance the night
Dance the night away
Dance the night",https://genius.com/Will-young-dance-the-night-away-lyrics,success
3VXoePG7JjYl2ay8fzLhtG,Very Kind,Will Young,1001448.0,Very Kind,Will Young,"Te de da da da da
Hmm, hmm
You run, you run, but this ain't livin'
You wish you could go back
And begin it all over
But it's over
You fight, you fight, you just keep sayin'
You'll feel better come sooner or later
In no time
It's been a long time
You still got made to turn it
You still got made to lift you up
You got wings but you can't fly
You got so much pain inside
You're very kind
In your dreams you're so high
But you don't live that in your life
You're very kind, you're so kind, hmm
Hmm, you do, you do
You love me baby
I can't fight when you leave me lazy
With your doubts, your doubts, hmm
You try, you try, an' there's no winner
You give, give more
But it just gets harder
In your mind we all try
(Hhh)
You still got time to turn it
You still got made to lift you up
You got wings but you can't fly
You got so much pain inside
You're very kind
In your dreams you're so high
But you don't live that in your life
You're very kind, you're so kind
You believe you're not good enough
It fills your mind, plays
It's in the way of you and I
I'd say a thousand times
I know you're one of a kind
You're so kind
Hm Hm
(Yea, yea)
A yea yea
Amm yea yea
Hey hey yea yea
Hm hm hm
Hm hm hm
Hm hm hm
You de da da da di
You got wings but you can't fly
'Cos you got so much pain inside
You're very kind, yea
An' in your dreams you're so high
But you don't live that in your life
You're very kind, you're so kind, yea
You got wings but you can't fly
You got so much pain inside
You're very kind' yea
An' in your dreams you're so high
But you don't live that in your life
You're very kind, you're so kind
You got wings
Mmm mmm, yea",https://genius.com/Will-young-very-kind-lyrics,success
41YN3uBz1PpFNZtmAAaSKS,Free,Will Young,1624618.0,Free,Will Young,"Aaa
Don't you see how I fight it?
Tryin' to hide from a life of real pain
Maybe time has allowed it
Feelin' the feel when I'm hearin' your name
'Cos you will decide how I survive?
Do you realize inside oh?
(Its you who'll decide and how will I survive?)
(When we're going to live a lie)
Just how much it's killing me
I'm just caught in the middle of you
Play my heart with a little bit of
Dangerous love
And I really want to be free, aa aa
Got me caught and I'm livin' in a low life world
It's your unoriginality that's killin' me
I've just got to be free
Now tell me what you want from me
Again and again you pretend it's alright, yea
I'm feelin' now that I can breathe
Can't comprehend how you can't recognize
'Cos time can't change the way I feel
(Time that, time has changed)
(Change the way I feel)
(You will, you will find)
And you will find that I'm gonna be
(Now that time has changed)
(Change the way I feel)
(You will, you will find)
More than you'll ever let me be
I'm just caught in the middle of you
Play my heart with a little bit of
(Hmm)
Dangerous love
And I really want to be free
(Want to be free)
Aa aa
Got me caught and I'm livin' in a low life world
It's your unoriginality that's killin' me
I've just got to be free
(Yea haa hey)
Yea
Free to disown you
'Cos I thought that I told you
You been treating me badly
And you misappreciate my love
Tryin' to breathe
But it's killin' me slowly
And you started to break me
With your dangerous love
(Ohh hmm)
Got to
Got to be free
(Hmm)
Got to
Got to be free
(Aa aa)
Got to
(Yea yea yea)
Got to be free
(Yea yea)
Got to
Got to be free
Aa aa
I'm just caught in the middle of you
(I'm just caught)
Play my heart with a little bit of
(Play my heart)
Dangerous love
And I really want to be free
(Yea)
Aa aa
Got me caught and I'm livin' in a low life world
(Got me caught, low life world )
It's your unoriginality that's killin' me
I've just got to be free
(Yea yea)
I'm just caught in the middle of you
(I'm just caught)
Play my heart with a little bit of
(Play my heart)
Dangerous love
(Play my heart)
And I really want to be free, aa aa
Got me caught and I'm livin' in a low life world
(Got me caught, low life world )",https://genius.com/Will-young-free-lyrics,success
2nO4uKyReZHH7JS61yT2nS,Going My Way,Will Young,1619330.0,Going My Way,Will Young,"In time gone by I lost my will
To try and find a clear way through
Now it's been a while since I asked myself what to do?
It's been a while since I played the fool
'Cause they said, ""Raise your game, leave the shame
In this place where you will remain unless you save your soul""
Now it's going my way, forget the time that I did then
Now it's going my way, I look and everything's okay
Got nothing much to say except the life that I now lead
Is going my way, going my way
It's been a while since I spent the day
The whole day wrapped up in my dreams
It took a while upstaging misery, it isn't all it seems
Now I smooth my hair feeling tight
I'm getting into something right
Living beyond those days
Now it's going my way, forget the time that I did then
Now it's going my way, I look and everything's okay
I've got nothing much to say except the life that I now lead
Is going my way, going my way
Yea hey yea yea
Going my way, aye aye aye aye
(Away, away)
I don't understand how it came to
(How it came to?)
I don't understand those depths of despair
(Those despairs)
I don't understand how it came to
(How it came to?)
I don't understand reaching that despair, ha haa
(Reaching that despair)
Now it's goin' my way, forget the time that I did then
(Forget the time that I did then)
Now it's goin' my way, I look and everything's okay
(Now, now, now)
I've got nothin' much to say except the life that I now lead
(Say)
Is going my way
(My way)
Going my way
Now it's going my way
Forget the time that I did then
(I did then)
Now it's going my way
I look and everything's okay
I've got nothing much to say except
The life that I now lead
Is going my way
(My way)
Going my way
(Yea eee yea)
'Cause I've
(Hmm mmm mmm)
Settled my mind
(Settled my mind)
Settled my mind
(Hmm mmm mmm)
Settled my
(My, my, mind)
Settled my mind
(Yea eee yea)
(Settled my mind)
Settled my mind
(Settled my mind)
Settled my mind
(Settled my mind)
Hmm hmm hmm",https://genius.com/Will-young-going-my-way-lyrics,success
4L4Ug6ah2UXH3JDlpeduRf,Out Of My Mind,Will Young,1274847.0,Out of My Mind,Will Young,"All you have to do is think about it
All you have to do is think about it
All you have to do is think about it
All you have to do is think about it
Baby, you drive me crazy all the time
When you play me
I'm burnin' with the lies that you feed me
Chasin' my despair
(I can see you smiling till I'm over the edge)
Do yourself a favor
Realize you won every game, yea
'Cos it's plain to see that I'm a mouse of a man, yea
Get me out of my mind
I don't feel so good
(Breakin' down the walls while I'm fallin' apart)
Get me out of my mind
I don't feel so good
(Try to understand)
(Just think about it)
Lately, you reply with your lies that I'm fadin'
(Ahh, ah)
You leave me high and dry
Over, over, over
You trip me around
I tell you baby
To do yourself a favor
Realize you win every game
'Cos it's plain to see that I'm a mouse of a man
Yea, you made a mouse of the man
Get me out of my mind
I don't feel so good
(Breakin' down the walls while I'm fallin' apart)
Get me out of my mind
I don't feel so good
(Try to understand that I'm losing my heart)
Get me out of my mind
I don't feel so good
(Breakin' down the walls while I'm fallin' apart)
Get me out of my mind
I don't feel so good
(Try to understand)
(Just think about it)
Yea, yea, ah, ah, yea, yea, yea, yea
(All you'll ever do is think about it)
Yea, yea, ah, ah, yea, yea, yea
(All you'll ever do is think about it)
Breakin' it to you
I'm breakin' it to you
Breakin' it to you
(All you'll ever do is think about it)
Breakin' it to you
I'm breakin' it to you
(Ooo, yea)
(All you'll ever do is think about it)
'Cos you've got to
Get me out of my mind
(Breakin' down the walls while I'm fallin' apart)
Get me out of my mind
(Try to understand that I'm losin' my heart)
Get me out of my mind
Get me out of my mind
Get me out of my mind
(Try to understand)
(Just think about it)",https://genius.com/Will-young-out-of-my-mind-lyrics,success
2JgPlDkLbdcRk5Jp3e7Pgm,Friday's Child,Will Young,1035100.0,Friday’s Child,Will Young,"We've been told to live our lives just workin' on the feelin'
Waitin' for the sun to shine on what we do believe in
In every man I hear the cry of someone else
A drownin' man reachin' out but no one hears
I know a man livin' out his life without a reason
And he says
Monday's got a beautiful baby
And Wednesday's child can never win
Little Saturday will work till he's crazy
But Friday's child, he was born to give
Now what about all the unborn people that will suffer
At the hands of Mr. Right who cares about no other
I see a mother who lets her children use her up
I know a father who just sacrificed his wayward son
I wonder what you give that someone else is needin'
Next to nothin'
Monday's got a beautiful baby
Wednesday's child can never win
Little Saturday will work till he's crazy
But Friday's child, he was born to give
Monday's got a beautiful baby
Wednesday's child can never win
Little Saturday will work till he's crazy
But Friday's child, this here you say
Monday's got a beautiful baby
Wednesday's child can never win
Little Saturday will work till he's crazy
But Friday's child
He was Friday's child
He was Friday's child
Friday's child
Friday's child",https://genius.com/Will-young-fridays-child-lyrics,success
5Kz6iIkOBZepijORtkfEvj,Listen For The Laugh,Bruce Cockburn,1615940.0,Listen for the Laugh,Bruce Cockburn,"Ah! Three, go. 

It's not the laughter of rain in the drain
It's not the laughter of a man in pain
It's not the laughter you can hide behind
It's not the laughter of a frightened mind

Balanced on the brink only waiting for a shove
You better listen for the laugh of love
Balanced on the brink only waiting for a shove
You better listen for the laugh of love

It's not the laughter of the gloating rich
It's not the laughter of the sacred bitch
It's not the laughter of the macho fool
It's not the laughter that obeys the rules

More of a chainsaw in a velvet glove
You better listen for the laugh of love
More of a chainsaw in a velvet glove
You better listen for the laugh of love

It's not the laughter of a child with toys
It's not the laughter of the President's boys
It's not the laughter of the media king
This laughter doesn't sell you anything

It's the wind in the wings of a diving dove
You better listen for the laugh of love
It's the wind in the wings of a diving dove
You better listen for the laugh of love
Whatever else you might be thinking of
You better listen for the laugh of love",https://genius.com/Bruce-cockburn-listen-for-the-laugh-lyrics,success
6uu5fXS1JPfX3pGArifC8A,All The Ways I Want You,Bruce Cockburn,1655485.0,All the Ways I Want You,Bruce Cockburn,"The hills are full of secrets
Owls watch by night
Down in town the bars are full
And the drunks are picking fights
These are things I know
But the facts are filtered through
All the ways I want you
All the ways I want you

2:19 freight train
Moaning somewhere near
I see you in the distance
But I can't get there from here
Hard to believe it's happening
But my whole world's shrunken to
All the ways I want you
All the ways I want you

Stars look down and laugh at me
I ought to take a bow
Don't have to tell them life's hard sometimes
There's one falling now
Nobody's here beside me
I can talk about it to
All the ways I want you
All the ways I want you
All the ways I want you
All the ways I want you",https://genius.com/Bruce-cockburn-all-the-ways-i-want-you-lyrics,success
6AGrDsrNVFeTTl4sQHfqsY,Bone In My Ear,Bruce Cockburn,1707128.0,Bone In My Ear,Bruce Cockburn,"There's a bone in my ear
Keeps singing your name
Sometimes it's like pleasure
Sometimes it's like pain
It's a small voice and quiet
But I hear it plain
There's a bone in my ear
Keeps singing your name

In my heart there's a an image
Like looking through glass
Could be looking at me
Could be looking right past
I don't like it when
I can't tell which is true
But I wouldn't trade the world
For that picture of you

Moon in the water
Cold light in the streets
Warmth in your fingers
Sweat in your sheets
Laid out like an offering
Where two currents meet
The river is dark
But the water is sweet

Wailing on the mountain
Smoke on the wind
Can't drown out the whisper
Or the scent of your skin
Don't know where it came from
But I know where it came
There's a bone in my ear
Keeps singing your name",https://genius.com/Bruce-cockburn-bone-in-my-ear-lyrics,success
1MdS31xYweAsuwj7fdR8xA,Burden Of The Angel/Beast,Bruce Cockburn,1176872.0,Burden of the Angel/Beast,Bruce Cockburn,"From the lying mirror to the movement of stars
Everybody's looking for who they are
Those who know don't have the words to tell
And the ones with the words don't know too well

Oh, could be the famine
Could be the feast
Could be the pusher
Could be the priest
Always ourselves we love the least
That's the burden of the angel/beast

Birds of paradise—birds of prey
Here tomorrow, gone today
Cross my forehead, cross my palm
Don't cross me or I'll do you harm

Oh, could be the famine
Could be the feast
Could be the pusher
Could be the priest
Always ourselves we love the least
That's the burden of the angel/beast

We go crying, we come laughing
Never understand the time we're passing
Kill for money, die for love
Whatever was God thinking of?

Oh, could be the famine
Could be the feast
Could be the pusher
Could be the priest
Always ourselves we love the least
That's the burden of the angel/beast",https://genius.com/Bruce-cockburn-burden-of-the-angel-beast-lyrics,success
0rHW20CX7izpkFLVj6RhtM,Scanning These Crowds,Bruce Cockburn,1593497.0,Scanning These Crowds,Bruce Cockburn,"I was half asleep in the washroom when they came in
Eyes like moonlight on barbed wire
And veins showing under the skin
The uniforms made me nervous
I got ready for the chase
But they left me scanning these crowds for some sign of your face

Something fell on Saskatchewan in 1885
Where is it now that we need it
In this century of jive?
The axe falls as if through water
Never leaves a trace
And I'm scanning these crowds for some sign of your face

The world shot down love as a spy, once upon a time ago
Now people stand around here
Like crows in the snow
Like the shadow of the rope on Louis Riel
They look so clean out of place
And I'm scanning these crowds for some sign of your face

Though storms may still kiss the grasslands with primal fire
In the land of passive revolution
Everything's for hire
Are they demons, are they lemmings
Or just the humans in this place?
Lord, I'm scanning these crowds for some sign of your face
Scanning these crowds for some sign of your face",https://genius.com/Bruce-cockburn-scanning-these-crowds-lyrics,success
31v1dqATMAtTPlZjOE3Tou,Southland Of The Heart,Bruce Cockburn,1214480.0,Southland of the Heart,Bruce Cockburn,"When the wild-eyed dogs of day to day
Come snapping at your heels
When there's so much coming at you
That you don't know how to feel
When they've taken all your money
And then come back for your clothes
When your hands are full of thorns
But you can't quit groping for the rose

In the southland of the heart
Where night blooms perfume the breeze
Lie down
Take your rest with me

When thoughts you've tried to leave behind
Keep sniping from the dark
When the fire burns inside you but
You jump from every spark
When your heart's beset by memories
You wish you'd never made
When the sun comes up an enemy
And nothing gives you shade

In the southland of the heart
Where the saints go lazily
Lie down
Take your rest with me
Lie down
Take your rest with me

When the preacher lays his insight down
And claims to lead the blind
When those you trust just get you hooked
And trifle with your mind
When the nightmare's creeping closer
And your wheels are in the mud
When everything's ambiguous
Except the taste of blood

In the southland of the heart
There's no question of degree
Lie down
Take your rest with me
In the southland of the heart
Everyone was always free
Lie down
Take your rest with me
Lie down
Take your rest with me",https://genius.com/Bruce-cockburn-southland-of-the-heart-lyrics,success
4M2EK2o9Zgy2jeqLVifARM,Train In The Rain,Bruce Cockburn,,,,,,not_found
59gijFhkwYNY2IAw0wg2PX,Someone I Used To Love,Bruce Cockburn,1747814.0,Someone I Used to Love,Bruce Cockburn,"All the days we've been together
All the days we've been apart
Add up to a bunch of nothing
If I'm not still in your heart
I never want you to be
Just a page in my history
Someone I used to love

Your voice breathed in my ear
Or on the telephone
All the tender things we've whispered
To keep from feeling alone
May they never come to be
Just cold gems set in memory
Of someone I used to love

This current flows between us
That will not be denied
You draw me in towards you
Like the moon pulls at the tide
May no shadow ever fall
That will make me have to call
You someone I used to love",https://genius.com/Bruce-cockburn-someone-i-used-to-love-lyrics,success
1dVT2CbuH0j9rKco5dvkLI,Love Loves You Too,Bruce Cockburn,1208891.0,Love Loves You Too,Bruce Cockburn,"Some people get to make the news
Some people get to say what's true
Everybody's got to find their own way through
But if you love love, then love loves you too

Some people get to fly by night
Some people get to shine a light
Everybody's got to find their own way through
But if you love love, then love loves you too
But if you love love, then love loves you too

Some of us hunger for the finer things
Some lust for power like the ancient kings
Some have to leave behind everything they thought they knew
Some people don't know how much trouble they can brew

Some take the burden of another's pain
Some spend forever for a moment's gain
Everybody's got to find their own way through
But if you love love, then love loves you too
But if you love love, then love loves you too",https://genius.com/Bruce-cockburn-love-loves-you-too-lyrics,success
3bM7rvHfGmCxRPOiPE177Y,Sunrise On The Mississippi,Bruce Cockburn,,,,,,not_found
2IHBrlBh7aurAatdXG2yTb,Closer to the Light,Bruce Cockburn,1704504.0,Closer to the Light,Bruce Cockburn,"There you go
Swimming deeper into mystery
Here I remain
Only seeing where you used to be
Stared at the ceiling
'Til my ears filled up with tears
Never got to know you
And suddenly you're out of here

Gone from mystery into mystery
Gone from daylight into night
Another step deeper
Into darkness
Closer to the light

Walked outside
Summer moon was nearly down
Mist on the fields
Holy stillness all around
Death's no stranger
No stranger than the life I've seen
Still I cried
Still I begged to get you back again

Gone from mystery into mystery
Gone from daylight into night
Another step deeper
Into darkness
Closer to the light
Another step deeper
Into darkness
Closer to the light


Gone from mystery into mystery
Gone from daylight into night
Another step deeper
Into darkness
Closer to the light
Another step deeper
Into darkness
Closer to the light",https://genius.com/Bruce-cockburn-closer-to-the-light-lyrics,success
7rrMXOKZNmoO10wgvwNj5H,Tie Me At The Crossroads,Bruce Cockburn,1706767.0,Tie Me At the Crossroads,Bruce Cockburn,"Tie me at the crossroads when I die
Hang me in the wind till I get good and dry
And the kids that pass can scratch their heads
And say, ""Who was that guy?""
Tie me at the crossroads when I die

Looking outward see what you can see
By the time you look at something it's already history
As the echoes of our passing fade, all there is to say
Is ""You know I loved you all in my particular way""

And tie me at the crossroads when I die
Hang me in the wind till I get good and dry
And the kids that pass can scratch their heads
And say, ""Who was that guy?""
Tie me at the crossroads when I die

It's more blessed to give than it is to receive
Except when it comes to free advice, I believe
But here I go anyway, back seat driving tonight
Move fast, stay cool, keep your eye on the front sight

And tie me at the crossroads when I die
Hang me in the wind till I get good and dry
And the kids that pass can scratch their heads
And say, ""Who was that guy?""
Tie me at the crossroads when I die
Tie me at the crossroads when I die
Tie me at the crossroads when I die",https://genius.com/Bruce-cockburn-tie-me-at-the-crossroads-lyrics,success
6LiqMOJNu3pMKO6M1cTsgA,Amber Waves,Tori Amos,119018.0,Amber Waves,Tori Amos,"Well, he lit you up like Amber Waves in his movie show
He fixed you up real good till I don't know you anymore
From ballet class to a lap dance straight to video
And the poolside news was that he would be launching you

Into every young man's bedroom you gave it up
On DVD and magazine you gave it up
A private rite of passage you gave it up
To every boy's sweet dream with their paper cuts

You said, ""He's got a healing machine
It glows in the dark, glows in the dark""
You say, ""There's not a lot of me
Left anymore, just leave it alone
But if you're by and you have the time
Tell the Northern lights to keep shining
Oh, lately it seems like they're drowning""

He could light you up and summon every swan to the lakeside
Off to Cabo San Lucas for some optical stimulus
Then you started to guess there was someone else through his flint glass
Seeing all of you immersed in his sepia

Into every young man's bedroom you gave it up
On DVD and magazine you gave it up
A private rite of passage you gave it up
To every boy's sweet dream with their paper cuts

You said, ""He's got a healing machine
It glows in the dark, glows in the dark""
You say, ""There's not a lot of me
Left anymore, just leave it alone
But if you're by and you have the time
Tell the Northern lights to keep shining
Oh, lately it seems like they're drowning""

So I went by, 'cause I had the time
Told the Northern Lights to keep shining
They told me to tell you they're waving",https://genius.com/Tori-amos-amber-waves-lyrics,success
